言語名	説明	作者	年代	ホームページ	作者Twitter	辞書	文法	分類	例文
3CL	英単語を縮めた三文字で意味を伝える国際補助語		2004-2006	"https://web.archive.org/web/20061209210102/http://members.goo.ne.jp/home/3cl/,https://web.archive.org/web/20041010133035/http://www.geocities.co.jp/SiliconValley/3338/,https://web.archive.org/web/20041031105937/http://www.geocities.co.jp/SiliconValley/3338/page019.html"			https://web.archive.org/web/20050128142511/http://www.geocities.co.jp/SiliconValley/3338/page006.html	国際補助語	
									
"アルカ,幻語"	FF4の登場人物リディアが使っている言語というイメージで1993年から製作が始まった。後にアプリオリ性を高めてアルシディアと呼ばれる架空世界の文化をバックグラウンドにした芸術言語となった。2001年から2008年まで続いたとされる制アルカ、2008年から製作された新生アルカ、2013年の作者収監後にコミュニティーによって存続した俗アルカなどの複数のバージョンがある。架空世界の文化のリアリティーにこだわり、辞書の各見出し語には長い語義がある。2017年にセレン氏個人の言語創作に戻る旨(https://togetter.com/li/1088421)の連絡があり、セレン氏個人の言語が俗に獄アルカと呼ばれる。かつては1990年代に創作集団によって製作されたとしていたが、2018年に嘘の製作史だったことがアルカの書(https://conlinguistics.org/blog/?p=689)で作者が告白した。ネット上に初めて公開されたのは2005年(https://w.atwiki.jp/kakis/pages/10469.html)。アルカに影響を受けて多くの人工言語が誕生した。	"seren arbazard(1981-),セレン・アルバザード,貞苅詩門"	1993-2013	"https://conlinguistics.org/arka/,https://w.atwiki.jp/kakis/"	https://twitter.com/serenarbazard	https://conlinguistics.org/klel/	https://conlinguistics.org/arka/study_yuli_2.html	芸術言語	
アーヴ語	作者による小説「星界の紋章」シリーズに登場する、日本語から派生したはるか未来の言語で、格助詞が名詞と縮約・融合して格変化が誕生し屈折語となっている。作者による別の短編集「夢の樹が接げたなら」では、普通名詞を持たない言語を話す宇宙船で生まれた子供というアイデアの話がある。日本製OSであるTRONの文字セットにはアーヴ語の文字アースが登録されている。インタビュー：http://www.sf-fantasy.com/magazine/interview/010201.shtml	森岡浩之	1996	http://dadh-baronr.s5.xrea.com/				芸術言語	
"エシュガル語,アスガル語(旧名1),エシガル語(旧名2)"	前置修飾と後置修飾が切り替わる文法を持つ。atwikiのページを辞書代わりに10年以上製作されている。	しゅわるつぉ	2007-2023	"https://w.atwiki.jp/suwiruzo/,http://shuwarutsu.blog87.fc2.com/(旧1),https://w.atwiki.jp/suwaruzu/(旧2)"		https://w.atwiki.jp/suwaruzu/pages/87.html	https://w.atwiki.jp/suwaruzu/pages/32.html		
									
クシュカ語	作者による小説「狗狼伝承」シリーズに登場する、中央アジアにかつて栄えたクシュカ帝国(Kus^kan Empire)で話されていたという体の言語で、ラテン語、ゲルマン諸語、日本語、フィンランド語を参考に作られている(https://dos.chottu.net/cl_ksk/index.html)。	新城カズマ(1951-)	1998-2010	https://web.archive.org/web/20050207043542/http://sanpo.electric-cat.org/	https://twitter.com/SinjowKazma	"https://sinjowkazma.hatenadiary.org/entry/20081103/1257177014,https://web.archive.org/web/20050207015331/http://sanpo.electric-cat.org/txt/ksyuka.htm"		芸術言語	
"GUMOSOPO,グモソ語,グモソぺ語"	5ch言語版で集団創作された言語(https://web.archive.org/web/20070312030742/http://www6.atwiki.jp/gumosopo/archive/20070103/c378835f5e04c43fbc94c41c5f267a7b)	ねらー	2005-2009	"https://w.atwiki.jp/gumosopo/,https://web.archive.org/web/20190330045327/https://www.geocities.jp/gumosopo/"		https://w.atwiki.jp/gumosopo/pages/39.html	https://w.atwiki.jp/gumosopo/pages/11.html		
金色語	同人音楽アルバム「7thMoon」中の曲名「金色ナリ我ガ姫ノ月」から着想して、ラテン語と古典ギリシャ語を参考に製作された(https://dos.chottu.net/cl_knj/index.html)。	綾波使い。	2002	"https://web.archive.org/web/20070904112402/http://www.pionet.co.jp/~shinji/nickey/2004/200404.html#kazu,https://web.archive.org/web/20070904095329/http://www.pionet.co.jp/~shinji/nickey/2005/200505.html,https://web.archive.org/web/20070904112700/http://www.pionet.co.jp/~shinji/nickey/2004/200407.html#adverb"				芸術言語	
									
ジェン語		漸屋じぇんや	2007						
"習作言語serix,セリッシュ"	人工言語の作り方を解説するために、アルカ作者のセレン氏によって作られた言語	"seren arbazard(1981-),セレン・アルバザード,貞苅詩門"	2006	https://arxidia.another.jp/lanxante/serix.html		"https://arxidia.another.jp/lanxante/serix_4.html,https://arxidia.another.jp/lanxante/serix_17.html"			
									
									
地球語	読み方のない絵文字によって意味を伝える言語。真珠湾攻撃の前日(1941-12-07)に生まれた作者のMcFarland Yoshikoさんが、サンフランシスコで受けたカルチャーショックで、渡米2年目に製作し始めた言語。美術館で見た1500年前の中国の書が読めたことに感銘を受け、世界に住むそれぞれの母語を持った人が共通の絵文字によって意思を伝えるという理想のもと制作された(https://www.earthlanguage.org/yoshikoJ.htm)。原案の公開はアドア1992年1月創刊号(北米毎日新聞社)、1999-01-09の日米タイムズ、2005-09-10のサンフランシスコKTSFの番組Japanese Journal、月刊言語2006年11月号(https://www.amazon.co.jp/exec/obidos/ASIN/B000IY0AM6/conlangjinkog-22/ref=nosim)で紹介された。	Yoshiko McFarland(1941-)	1988-2021	https://www.earthlanguage.org/		https://www.earthlanguage.org/dic/dic.htm	https://www.earthlanguage.org/jsyst/definit.htm	国際補助語	
トラブ語	ホームページがあるが、現在は広告に転送されアーカイブでも見れない(http://torabicarchitect.hanagumori.com/index.html)	"黒田龍司,クロ"	2006	https://archive.md/FwAMP			http://vanoneeme.blog.fc2.com/blog-entry-40.html		
"ノシロ語,NOXILO"	SVO、SOVの語順を入れ替えても良い、「部首」と呼ばれる接辞がつくことでおおよその単語の意味が推定できるなどのユニークな特徴をもった国際補助語。巣系のすべての人にとって学習コストが等しくなることを理念にしている。将来的にVSO語順も採用する予定。国際補助語のため、公式サイトは多言語対応している。公式サイトには2時間速習コースがあるほか、入門書が出版されている。公式文法書は「~号ホームページ」という名前の長大な複数のページに分割されている。非公式の概説(https://migdal.jp/slaimsan/%E3%83%8E%E3%82%B7%E3%83%AD%E8%AA%9E%E3%81%AE%E6%A6%82%E8%AA%AC-%E5%8F%8A%E3%81%B3-%E5%95%8F%E9%A1%8C%E7%82%B9%E3%81%A8%E3%81%9D%E3%81%AE%E8%A7%A3%E6%B1%BA%E6%A1%88-21b2)がある。	水田扇太郎(1948-)	1997-2023	https://www2s.biglobe.ne.jp/%7Enoxilo/index.htm		"https://www2s.biglobe.ne.jp/~noxilo/sub3f.htm,https://www2s.biglobe.ne.jp/~noxilo/sub3e.htm"	https://www2s.biglobe.ne.jp/~noxilo/mokuji3.htm	"国際補助語,アポステリオリ言語"	
"ノジエール語,ノジ語,Nozie'r"	作者が中学生の時から制作されている。Html形式の辞書がダウンロードできる。	Grar Evidia	2006-2007	https://nozieer.yukishigure.com/		https://nozieer.yukishigure.com/zisyo.html	https://nozieer.yukishigure.com/bunpou.html		
nosara語	"自動車評論家国沢光宏氏の特徴的な言葉遣い「国沢語」やホロン部の言葉遣い「ホロン語」から語彙を借用している。他にも印欧祖語やアイヌ語、アラビア語、ヘブライ語からの借用がある。SVOまたはSOV語順。SVO語順のときは後置修飾、SOV語順の時は前置修飾になる。ブログの記事ごとに内容が分散している。https://blog.goo.ne.jp/littorio/e/0fe97108d2822c6110bb41ab12213a54,https://blog.goo.ne.jp/littorio/e/4df3162cdfb231e04dbdc68e1ccf9531,https://blog.goo.ne.jp/littorio/e/d0d0a029e6bb1f3c212e76cb98e920dc,https://blog.goo.ne.jp/littorio/e/4df3162cdfb231e04dbdc68e1ccf9531,https://blog.goo.ne.jp/littorio/e/4df3162cdfb231e04dbdc68e1ccf9531,https://blog.goo.ne.jp/littorio/e/3a4c1843978f9ba9f91b9255053f820e,アイヌ語からの借用：https://blog.goo.ne.jp/littorio/e/573cd26e077018b1b3296665182a0072,https://blog.goo.ne.jp/littorio/e/1124fb4874d0403e89f3a2f1c7bb8f04,https://blog.goo.ne.jp/littorio/e/4df3162cdfb231e04dbdc68e1ccf9531,ホロン語からの借用https://blog.goo.ne.jp/littorio/e/d0d0a029e6bb1f3c212e76cb98e920dc"	littorio	2008	"https://blog.goo.ne.jp/littorio/e/4808a26b4ee27c0e157124b082075563,https://blog.goo.ne.jp/littorio/c/47a7618344873d0ed140e9c1014b2d8c/8"					
kangan語	同作者のnosara語を簡略化したもの。Hebgulと呼ばれる独自文字を用いる(https://blog.goo.ne.jp/littorio/e/3114b7498f80d5c9c0cac3e3ff2e4d9c)	littorio	2010	https://blog.goo.ne.jp/littorio/e/b2d3735212da0bdc29999f74f27a803d					Kon kalan dara「これはペンです」
新民語(Xinmingo)	漢字一字に対応する一音節の単語を組み合わせて文を作る言語	littorio	2011	https://blog.goo.ne.jp/littorio/e/9d3de0eecd07b7edd7bb2859a584b07b					我愛汝 Ga ai jo.「私はあなたを愛します」
Tikvanto	セレン氏に掲示板上でいろいろな言語の提案を「何を試しても「ああ、これはア○カ第×期の＊＊＊＊＊＊で試したけれどあまりぱっとしなかったのです。それよりも●●の書の新作が…（以下ア○カの宣伝を30倍返しされる）」と瞬殺されて作者がやる気をなくして終了となる」ことに不満を持ち、その腹いせにセレン氏の嫌う「英語ピジン」、「エスペラント互換ツール」の二要素を組み合わせた言語	littorio	2012	"https://blog.goo.ne.jp/littorio/e/3363d1daf847565161f0f1e21ba6b27d,https://blog.goo.ne.jp/littorio/e/ecbc03c097764f13de94e67e0b07037a"					Fotero un Kindo.「父と子」
"Laamisar,ラーミサル"	amiko「友達」、burlamiko「敵」nuko「猫」など、ドイツ語をはじめとした世界中の言語から単語を借用し、接尾辞や接頭辞を加えることで単語を派生させるアポステリオリ言語。アルメニア文字をベースにしたラーミサル文字を使用する。https://blog.goo.ne.jp/littorio/e/52e4849076c8df7d48fc11bb88a1c8f1	littorio	2006	"https://blog.goo.ne.jp/littorio/e/099ed0448ce7936e528d15d639ea6f01,https://blog.goo.ne.jp/littorio/e/e430ccf18fa2e532eff01d2d9708df32"			https://blog.goo.ne.jp/littorio/e/b8729ab52fba1dba6f5d70e5f2eaa5fa	アポステリオリ言語	Mi nujen fumin. Si nujit fumiun.「私は手紙を書く。あなたは手紙(複数)を書いた。」
"Kewpanta,Kewpanto"	印欧祖語の単語を可能な限り使う単語。エスペラントのような品詞接尾辞を持つ。主の祈り：https://blog.goo.ne.jp/littorio/e/5c9410e54c3c36def31e88020f58dadc	littorio	2013	"https://blog.goo.ne.jp/littorio/e/7af21f7e3bbf77205635ff6916a0cfed,https://blog.goo.ne.jp/littorio/e/29254240a1d33f5809f90adb608ee988"					
mixic	rjuka(榴火)(穆念真)さん(https://mixi.jp/show_friend.pl?pt=1702130085&sig=59f40a4a7785ab19e1703fd0610057289874c8a0&content_id=543186&route_trace=010001900000&id=505702)が発起人となったmixiコミュニティーで製作した言語。	rjuka(穆念真)さんほか計51人	2006-2019	https://mixi.jp/view_community.pl?id=543186		https://mixi.jp/view_bbs.pl?id=3877215&comm_id=543186	https://mixi.jp/view_bbs.pl?id=3877019&comm_id=543186		
ムンビーナ語	歴史がある。90年代風のアニメ絵入りの解説がある。ホームページでは作者の短い日記とムンビーナ語の短文が公開され、毎日更新されている。	"大元帥,PHALSAIL HeadQuarters"	1980-2023	http://ww22.tiki.ne.jp/%7Ephalsail/gengo/munb/index.htm					
ラングォ･コモーノ		"大元帥,PHALSAIL HeadQuarters"	2009-2023	http://ww22.tiki.ne.jp/~phalsail/gengo/comono/index.htm					
トルキィ		"大元帥,PHALSAIL HeadQuarters"	2012	http://ww22.tiki.ne.jp/~phalsail/gengo/trky/index.htm		http://ww22.tiki.ne.jp/~phalsail/gengo/trky/tr_ha.htm			
カトゥ・アト		"大元帥,PHALSAIL HeadQuarters"	2018-2019	http://ww22.tiki.ne.jp/~phalsail/gengo/kauato/index.htm		http://ww22.tiki.ne.jp/~phalsail/gengo/kauato/neue_wort.htm			
ガハムキセラ		"大元帥,PHALSAIL HeadQuarters"	2015	http://ww22.tiki.ne.jp/~phalsail/gengo/gahamu/index.htm					
バルティオール	ラテン語、英語、フランス語、ドイツ語、日本語などをベースとした創作用の言語。言語仕様がGFDLライセンスで公開されているため、改良したり派生語を自由に作ることができる。作者がGADUMファンのため、サイトで小説が公開されている。FAQ(https://web.archive.org/web/20070904182453/http://www5.ocn.ne.jp/~meteors/html/faq.html)	meteor	2006-2007	https://web.archive.org/web/20080911101405/http://www5.ocn.ne.jp/~meteors/html/top.html		https://web.archive.org/web/20070904182804/http://www5.ocn.ne.jp/~meteors/bartivor.txt	https://web.archive.org/web/20070823085121/http://www5.ocn.ne.jp/~meteors/html/bartivor.html		
Lingo Mondo	ホームページトップのみアーカイブに残っているが文法や語彙は2023年時点でアクセスできない。人工言語野では活用や格変化がないと紹介されている。(https://dos.chottu.net/conlang_link.html?l=index)	縄田幹治	2006-2012	https://web.archive.org/web/20060813110655/http://ip.tosp.co.jp/i.asp?I=lingomondo				国際補助語	
									
LoCoS	"多摩美術大学デザイン学科の太田幸夫教授が1971年に雑誌グラフィックデザイン42号に公表、1991年にウィーンで行われた視覚コミュニケーションの国際会議で発表した、ピクトグラムによる視覚型国際補助語。作者の太田教授は、非常出口のピクトグラムを日本以外に広めたことで知られる。,https://web.archive.org/web/20070602161826/http://www.jiten.com/dicmi/docs/l/6981s.htm,https://web.archive.org/web/20080221165546/http://www.innovative.jp/interview/2006/0125.php"	太田幸夫	1991-2008						
